{
  "$schema": "http://json-schema.org/draft-07/schema#",
  "title": "Sell It For Me Lead Response",
  "type": "object",
  "additionalProperties": false,
  "required": [
    "success",
    "error",
    "sell_it_for_me_lead_id",
    "has_credits",
    "product",
    "user_id",
    "mobile",
    "mobile_verified",
    "mobile_uuid"
  ],
  "properties": {
    "success": {
      "type": "string"
    },
    "error": {
      "type": ["string", "null"]
    },
    "sell_it_for_me_lead_id": {
      "type": ["integer", "null"]
    },
    "has_credits": {
      "type": "boolean"
    },
    "product": {
      "type": "object",
      "additionalProperties": false,
      "required": [
        "id",
        "name",
        "price",
        "type"
      ],
      "properties": {
        "id": {
          "type": ["integer", "null"]
        },
        "name": {
          "type": ["string", "null"]
        },
        "price": {
          "type": ["number", "string", "null"]
        },
        "type": {
          "type": "string"
        }
      }
    },
    "user_id": {
      "type": ["integer", "null"]
    },
    "mobile": {
      "type": "string"
    },
    "mobile_verified": {
      "type": "boolean"
    },
    "mobile_uuid": {
      "type": ["string", "null"]
    }
  }
}
